0,1,2,3,4,5,6,7,8,9
از خاطرشان رفته‌اند (az xâtérešân rafté-and),آنها,از خاطرشان رفته است (az xâtérešân rafté ast),وی,از خاطرشان رفته بودند (az xâtérešân rafté búdand),آنها,از خاطرشان رفته بود (az xâtérešân rafté búd),وی,,
,,,,,,,,,
,از خاطرشان خواهیم رفت (az xâtérešân xâhím raft),ما,از خاطرشان خواهم رفت (az xâtérešân xâhám raft),من,future,,,,
از خاطرشان خواهید رفت (az xâtérešân xâhíd raft),شما,از خاطرشان خواهی رفت (az xâtérešân xâhí raft),تو,,,,,,
از خاطرشان خواهند رفت (az xâtérešân xâhánd raft),آنها,از خاطرشان خواهد رفت (az xâtérešân xâhád raft),وی,,,,,,
subjunctive,,,,,,,,,
از خاطرشان رفته باشیم (az xâtérešân rafté bấšim),ما,از خاطرشان رفته باشم (az xâtérešân rafté bấšam),من,past,از خاطرشان برویم (az xâtérešân béravim),ما,از خاطرشان بروم (az xâtérešân béravam),من,present
از خاطرشان رفته باشید (az xâtérešân rafté bấšid),شما,از خاطرشان رفته باشی (az xâtérešân rafté bấši),تو,از خاطرشان بروید (az xâtérešân béravid),شما,از خاطرشان بروی (az xâtérešân béravi),تو,,
از خاطرشان رفته باشند (az xâtérešân rafté bấšand),آنها,از خاطرشان رفته باشد (az xâtérešân rafté bấšad),وی,از خاطرشان بروند (az xâtérešân béravand),آنها,از خاطرشان برود (az xâtérešân béravad),وی,,
,,,,,,,,,
,از خاطرشان بروید (az xâtérešân béravid),شما,از خاطرشان برو (az xâtérešân bérav),تو,imperative,,,,
از خاطرشون رفتن (az xâtérešun raftán),infinitive,,,,,,,,
,,,,,,,,,
از خاطرشون رفت (az xâtérešun raft),past stem,از خاطرشون ره (az xâtérešun re),present stem,,,,,,
از خاطرشون رفته (az xâtérešun rafté),past participle,از خاطرشون رونده (az xâtérešun ravandé),present participle,,,,,,
indicative,,,,,,,,,
از خاطرشون رفتیم (az xâtérešun ráftim),ما,از خاطرشون رفتم (az xâtérešun ráftam),من,past,از خاطرشون ریم (az xâtérešun rim),ما,از خاطرشون رم (az xâtérešun ram),من,aorist
از خاطرشون رفتین (az xâtérešun ráftin),شما,از خاطرشون رفتی (az xâtérešun ráfti),تو,از خاطرشون رین (az xâtérešun rin),شما,از خاطرشون ری (az xâtérešun ri),تو,,
از خاطرشون رفتن (az xâtérešun ráftan),اونها,از خاطرشون رفت (az xâtérešun raft),اون,از خاطرشون رن (az xâtérešun ran),اونها,از خاطرشون ره (az xâtérešun re),اون,,
,,,,,,,,,
از خاطرشون می‌رفتیم (az xâtérešun mí-raftim),ما,از خاطرشون می‌رفتم (az xâtérešun mí-raftam),من,past (imperfect),از خاطرشون می‌ریم (az xâtérešun mí-rim),ما,از خاطرشون می‌رم (az xâtérešun mí-ram),من,present (imperfect)
از خاطرشون می‌رفتین (az xâtérešun mí-raftin),شما,از خاطرشون می‌رفتی (az xâtérešun mí-rafti),تو,از خاطرشون می‌رین (az xâtérešun mí-rin),شما,از خاطرشون می‌ری (az xâtérešun mí-ri),تو,,
از خاطرشون می‌رفتن (az xâtérešun mí-raftan),اونها,از خاطرشون می‌رفت (az xâtérešun mí-raft),اون,از خاطرشون می‌رن (az xâtérešun mí-ran),اونها,از خاطرشون می‌ره (az xâtérešun mí-re),اون,,
,,,,,,,,,
داشتیم از خاطرشون می‌رفتیم (dấštim az xâtérešun mí-raftim),ما,داشتم از خاطرشون می‌رفتم (dấštam az xâtérešun mí-raftam),من,past progressive,داریم از خاطرشون می‌ریم (dấrim az xâtérešun mí-rim),ما,دارم از خاطرشون می‌رم (dấram az xâtérešun mí-ram),من,present progressive
داشتین از خاطرشون می‌رفتین (dấštin az xâtérešun mí-raftin),شما,داشتی از خاطرشون می‌رفتی (dấšti az xâtérešun mí-rafti),تو,دارین از خاطرشون می‌رین (dấrin az xâtérešun mí-rin),شما,داری از خاطرشون می‌ری (dấri az xâtérešun mí-ri),تو,,
داشتن از خاطرشون می‌رفتن (dấštan az xâtérešun mí-raftan),اونها,داشت از خاطرشون می‌رفت (dấšt az xâtérešun mí-raft),اون,دارن از خاطرشون می‌رن (dấran az xâtérešun mí-ran),اونها,داره از خاطرشون می‌ره (dấre az xâtérešun mí-re),اون,,
,,,,,,,,,
از خاطرشون رفته‌ایم (az xâtérešun raftím),ما,از خاطرشون رفته‌ام (az xâtérešun raftám),من,present perfect,از خاطرشون رفته بودیم (az xâtérešun rafté búdim),ما,از خاطرشون رفته بودم (az xâtérešun rafté búdam),من,pluperfect
از خاطرشون رفته‌این (az xâtérešun raftín),شما,از خاطرشون رفته‌ای (az xâtérešun raftí),تو,از خاطرشون رفته بودین (az xâtérešun rafté búdin),شما,از خاطرشون رفته بودی (az xâtérešun rafté búdi),تو,,
از خاطرشون رفته‌ان (az xâtérešun raftán),اونها,از خاطرشون رفته (az xâtérešun rafté),اون,از خاطرشون رفته بودن (az xâtérešun rafté búdan),اونها,از خاطرشون رفته بود (az xâtérešun rafté bud),اون,,
subjunctive,,,,,,,,,
از خاطرشون رفته باشیم (az xâtérešun rafté bấšim),ما,از خاطرشون رفته باشم (az xâtérešun rafté bấšam),من,past,از خاطرشون بریم (az xâtérešun bérim),ما,از خاطرشون برم (az xâtérešun béram),من,present
از خاطرشون رفته باشین (az xâtérešun rafté bấšin),شما,از خاطرشون رفته باشی (az xâtérešun rafté bấši),تو,از خاطرشون برین (az xâtérešun bérin),شما,از خاطرشون بری (az xâtérešun béri),تو,,
از خاطرشون رفته باشن (az xâtérešun rafté bấšan),اونها,از خاطرشون رفته باشه (az xâtérešun rafté bấše),اون,از خاطرشون برن (az xâtérešun béran),اونها,از خاطرشون بره (az xâtérešun bére),اون,,
,,,,,,,,,
,از خاطرشون برین (az xâtérešun bérin),شما,از خاطرشون برو (az xâtérešun borô),تو,imperative,,,,
از خاطرشون رفتن (az xâtérešun raftán),infinitive,,,,,,,,
,,,,,,,,,
از خاطرشون رفت (az xâtérešun raft),past stem,از خاطرشون ره (az xâtérešun re),present stem,,,,,,
از خاطرشون رفته (az xâtérešun rafté),past participle,از خاطرشون رونده (az xâtérešun ravandé),present participle,,,,,,
indicative,,,,,,,,,
از خاطرشون رفتیم (az xâtérešun ráftim),ما,از خاطرشون رفتم (az xâtérešun ráftam),من,past,از خاطرشون ریم (az xâtérešun reym),ما,از خاطرشون رم (az xâtérešun ram),من,aorist
از خاطرشون رفتین (az xâtérešun ráftin),شما,از خاطرشون رفتی (az xâtérešun ráfti),تو,از خاطرشون رین (az xâtérešun reyn),شما,از خاطرشون ری (az xâtérešun rey),تو,,
از خاطرشون رفتن (az xâtérešun ráftan),اونها,از خاطرشون رفت (az xâtérešun raft),اون,از خاطرشون رن (az xâtérešun ran),اونها,"از خاطرشون ره / رد (az xâtérešun re, rad)",اون,,
,,,,,,,,,
از خاطرشون می‌رفتیم (az xâtérešun mí-raftim),ما,از خاطرشون می‌رفتم (az xâtérešun mí-raftam),من,past (imperfect),از خاطرشون می‌ریم (az xâtérešun mí-reym),ما,از خاطرشون می‌رم (az xâtérešun mí-ram),من,present (imperfect)
از خاطرشون می‌رفتین (az xâtérešun mí-raftin),شما,از خاطرشون می‌رفتی (az xâtérešun mí-rafti),تو,از خاطرشون می‌رین (az xâtérešun mí-reyn),شما,از خاطرشون می‌ری (az xâtérešun mí-rey),تو,,
از خاطرشون می‌رفتن (az xâtérešun mí-raftan),اونها,از خاطرشون می‌رفت (az xâtérešun mí-raft),اون,از خاطرشون می‌رن (az xâtérešun mí-ran),اونها,از خاطرشون می‌ره / می‌رد (az xâtérešun mí-re / mí-rad),اون,,
,,,,,,,,,
داشتیم از خاطرشون می‌رفتیم (dấštim az xâtérešun mí-raftim),ما,داشتم از خاطرشون می‌رفتم (dấštam az xâtérešun mí-raftam),من,past progressive,داریم از خاطرشون می‌ریم (dấrim az xâtérešun mí-reym),ما,دارم از خاطرشون می‌رم (dấram az xâtérešun mí-ram),من,present progressive
داشتین از خاطرشون می‌رفتین (dấštin az xâtérešun mí-raftin),شما,داشتی از خاطرشون می‌رفتی (dấšti az xâtérešun mí-rafti),تو,دارین از خاطرشون می‌رین (dấrin az xâtérešun mí-reyn),شما,داری از خاطرشون می‌ری (dấri az xâtérešun mí-rey),تو,,
داشتن از خاطرشون می‌رفتن (dấštan az xâtérešun mí-raftan),اونها,داشت از خاطرشون می‌رفت (dấšt az xâtérešun mí-raft),اون,دارن از خاطرشون می‌رن (dấran az xâtérešun mí-ran),اونها,داره از خاطرشون می‌ره / می‌رد (dấre az xâtérešun mí-re / mí-rad),اون,,
,,,,,,,,,
از خاطرشون رفته‌ایم (az xâtérešun raftím),ما,از خاطرشون رفته‌ام (az xâtérešun raftám),من,present perfect,از خاطرشون رفته بودیم (az xâtérešun rafté búdim),ما,از خاطرشون رفته بودم (az xâtérešun rafté búdam),من,pluperfect
از خاطرشون رفته‌این (az xâtérešun raftín),شما,از خاطرشون رفته‌ای (az xâtérešun raftí),تو,از خاطرشون رفته بودین (az xâtérešun rafté búdin),شما,از خاطرشون رفته بودی (az xâtérešun rafté búdi),تو,,
از خاطرشون رفته‌ان (az xâtérešun raftán),اونها,از خاطرشون رفته (az xâtérešun rafté),اون,از خاطرشون رفته بودن (az xâtérešun rafté búdan),اونها,از خاطرشون رفته بود (az xâtérešun rafté bud),اون,,
subjunctive,,,,,,,,,
از خاطرشون رفته باشیم (az xâtérešun rafté bấšim),ما,از خاطرشون رفته باشم (az xâtérešun rafté bấšam),من,past,از خاطرشون بریم (az xâtérešun béreym),ما,از خاطرشون برم (az xâtérešun béram),من,present
از خاطرشون رفته باشین (az xâtérešun rafté bấšin),شما,از خاطرشون رفته باشی (az xâtérešun rafté bấši),تو,از خاطرشون برین (az xâtérešun béreyn),شما,از خاطرشون بری (az xâtérešun bérey),تو,,
از خاطرشون رفته باشن (az xâtérešun rafté bấšan),اونها,از خاطرشون رفته باشه (az xâtérešun rafté bấše),اون,از خاطرشون برن (az xâtérešun béran),اونها,"از خاطرشون بره / برد (az xâtérešun bére, bérad)",اون,,
,,,,,,,,,
,از خاطرشون برین (az xâtérešun béreyn),شما,از خاطرشون برو (az xâtérešun borô),تو,imperative,,,,
