0,1,2,3,4,5,6,7,8,9
از خاطرمون رفته‌این (az xâtéremun raftín),شما,از خاطرمون رفته‌ای (az xâtéremun raftí),تو,از خاطرمون رفته بودین (az xâtéremun rafté búdin),شما,از خاطرمون رفته بودی (az xâtéremun rafté búdi),تو,,
از خاطرمون رفته‌ان (az xâtéremun raftán),اونها,از خاطرمون رفته (az xâtéremun rafté),اون,از خاطرمون رفته بودن (az xâtéremun rafté búdan),اونها,از خاطرمون رفته بود (az xâtéremun rafté bud),اون,,
subjunctive,,,,,,,,,
از خاطرمون رفته باشیم (az xâtéremun rafté bấšim),ما,از خاطرمون رفته باشم (az xâtéremun rafté bấšam),من,past,از خاطرمون بریم (az xâtéremun bérim),ما,از خاطرمون برم (az xâtéremun béram),من,present
از خاطرمون رفته باشین (az xâtéremun rafté bấšin),شما,از خاطرمون رفته باشی (az xâtéremun rafté bấši),تو,از خاطرمون برین (az xâtéremun bérin),شما,از خاطرمون بری (az xâtéremun béri),تو,,
از خاطرمون رفته باشن (az xâtéremun rafté bấšan),اونها,از خاطرمون رفته باشه (az xâtéremun rafté bấše),اون,از خاطرمون برن (az xâtéremun béran),اونها,از خاطرمون بره (az xâtéremun bére),اون,,
,,,,,,,,,
,از خاطرمون برین (az xâtéremun bérin),شما,از خاطرمون برو (az xâtéremun borô),تو,imperative,,,,
از خاطرمون رفتن (az xâtéremun raftán),infinitive,,,,,,,,
,,,,,,,,,
از خاطرمون رفت (az xâtéremun raft),past stem,از خاطرمون ره (az xâtéremun re),present stem,,,,,,
از خاطرمون رفته (az xâtéremun rafté),past participle,از خاطرمون رونده (az xâtéremun ravandé),present participle,,,,,,
indicative,,,,,,,,,
از خاطرمون رفتیم (az xâtéremun ráftim),ما,از خاطرمون رفتم (az xâtéremun ráftam),من,past,از خاطرمون ریم (az xâtéremun reym),ما,از خاطرمون رم (az xâtéremun ram),من,aorist
از خاطرمون رفتین (az xâtéremun ráftin),شما,از خاطرمون رفتی (az xâtéremun ráfti),تو,از خاطرمون رین (az xâtéremun reyn),شما,از خاطرمون ری (az xâtéremun rey),تو,,
از خاطرمون رفتن (az xâtéremun ráftan),اونها,از خاطرمون رفت (az xâtéremun raft),اون,از خاطرمون رن (az xâtéremun ran),اونها,"از خاطرمون ره / رد (az xâtéremun re, rad)",اون,,
,,,,,,,,,
از خاطرمون می‌رفتیم (az xâtéremun mí-raftim),ما,از خاطرمون می‌رفتم (az xâtéremun mí-raftam),من,past (imperfect),از خاطرمون می‌ریم (az xâtéremun mí-reym),ما,از خاطرمون می‌رم (az xâtéremun mí-ram),من,present (imperfect)
از خاطرمون می‌رفتین (az xâtéremun mí-raftin),شما,از خاطرمون می‌رفتی (az xâtéremun mí-rafti),تو,از خاطرمون می‌رین (az xâtéremun mí-reyn),شما,از خاطرمون می‌ری (az xâtéremun mí-rey),تو,,
از خاطرمون می‌رفتن (az xâtéremun mí-raftan),اونها,از خاطرمون می‌رفت (az xâtéremun mí-raft),اون,از خاطرمون می‌رن (az xâtéremun mí-ran),اونها,از خاطرمون می‌ره / می‌رد (az xâtéremun mí-re / mí-rad),اون,,
,,,,,,,,,
داشتیم از خاطرمون می‌رفتیم (dấštim az xâtéremun mí-raftim),ما,داشتم از خاطرمون می‌رفتم (dấštam az xâtéremun mí-raftam),من,past progressive,داریم از خاطرمون می‌ریم (dấrim az xâtéremun mí-reym),ما,دارم از خاطرمون می‌رم (dấram az xâtéremun mí-ram),من,present progressive
داشتین از خاطرمون می‌رفتین (dấštin az xâtéremun mí-raftin),شما,داشتی از خاطرمون می‌رفتی (dấšti az xâtéremun mí-rafti),تو,دارین از خاطرمون می‌رین (dấrin az xâtéremun mí-reyn),شما,داری از خاطرمون می‌ری (dấri az xâtéremun mí-rey),تو,,
داشتن از خاطرمون می‌رفتن (dấštan az xâtéremun mí-raftan),اونها,داشت از خاطرمون می‌رفت (dấšt az xâtéremun mí-raft),اون,دارن از خاطرمون می‌رن (dấran az xâtéremun mí-ran),اونها,داره از خاطرمون می‌ره / می‌رد (dấre az xâtéremun mí-re / mí-rad),اون,,
,,,,,,,,,
از خاطرمون رفته‌ایم (az xâtéremun raftím),ما,از خاطرمون رفته‌ام (az xâtéremun raftám),من,present perfect,از خاطرمون رفته بودیم (az xâtéremun rafté búdim),ما,از خاطرمون رفته بودم (az xâtéremun rafté búdam),من,pluperfect
از خاطرمون رفته‌این (az xâtéremun raftín),شما,از خاطرمون رفته‌ای (az xâtéremun raftí),تو,از خاطرمون رفته بودین (az xâtéremun rafté búdin),شما,از خاطرمون رفته بودی (az xâtéremun rafté búdi),تو,,
از خاطرمون رفته‌ان (az xâtéremun raftán),اونها,از خاطرمون رفته (az xâtéremun rafté),اون,از خاطرمون رفته بودن (az xâtéremun rafté búdan),اونها,از خاطرمون رفته بود (az xâtéremun rafté bud),اون,,
subjunctive,,,,,,,,,
از خاطرمون رفته باشیم (az xâtéremun rafté bấšim),ما,از خاطرمون رفته باشم (az xâtéremun rafté bấšam),من,past,از خاطرمون بریم (az xâtéremun béreym),ما,از خاطرمون برم (az xâtéremun béram),من,present
از خاطرمون رفته باشین (az xâtéremun rafté bấšin),شما,از خاطرمون رفته باشی (az xâtéremun rafté bấši),تو,از خاطرمون برین (az xâtéremun béreyn),شما,از خاطرمون بری (az xâtéremun bérey),تو,,
از خاطرمون رفته باشن (az xâtéremun rafté bấšan),اونها,از خاطرمون رفته باشه (az xâtéremun rafté bấše),اون,از خاطرمون برن (az xâtéremun béran),اونها,"از خاطرمون بره / برد (az xâtéremun bére, bérad)",اون,,
,,,,,,,,,
,از خاطرمون برین (az xâtéremun béreyn),شما,از خاطرمون برو (az xâtéremun borô),تو,imperative,,,,
از خاطرتان رفتن (az xâtéretân raftán),infinitive,,,,,,,,
,,,,,,,,,
از خاطرتان رفت (az xâtéretân raft),past stem,از خاطرتان رو (az xâtéretân rav),present stem,,,,,,
از خاطرتان رفته (az xâtéretân rafté),past participle,از خاطرتان رونده (az xâtéretân ravandé),present participle,,,,,,
indicative,,,,,,,,,
از خاطرتان رفتیم (az xâtéretân ráftim),ما,از خاطرتان رفتم (az xâtéretân ráftam),من,past,از خاطرتان رویم (az xâtéretân rávim),ما,از خاطرتان روم (az xâtéretân rávam),من,aorist
از خاطرتان رفتید (az xâtéretân ráftid),شما,از خاطرتان رفتی (az xâtéretân ráfti),تو,از خاطرتان روید (az xâtéretân rávid),شما,از خاطرتان روی (az xâtéretân rávi),تو,,
از خاطرتان رفتند (az xâtéretân ráftand),آنها,از خاطرتان رفت (az xâtéretân raft),وی,از خاطرتان روند (az xâtéretân rávand),آنها,از خاطرتان رود (az xâtéretân rávad),وی,,
,,,,,,,,,
از خاطرتان می‌رفتیم (az xâtéretân mí-raftim),ما,از خاطرتان می‌رفتم (az xâtéretân mí-raftam),من,past (imperfect),از خاطرتان می‌رویم (az xâtéretân mí-ravim),ما,از خاطرتان می‌روم (az xâtéretân mí-ravam),من,present (imperfect)
از خاطرتان می‌رفتید (az xâtéretân mí-raftid),شما,از خاطرتان می‌رفتی (az xâtéretân mí-rafti),تو,از خاطرتان می‌روید (az xâtéretân mí-ravid),شما,از خاطرتان می‌روی (az xâtéretân mí-ravi),تو,,
از خاطرتان می‌رفتند (az xâtéretân mí-raftand),آنها,از خاطرتان می‌رفت (az xâtéretân mí-raft),وی,از خاطرتان می‌روند (az xâtéretân mí-ravand),آنها,از خاطرتان می‌رود (az xâtéretân mí-ravad),وی,,
,,,,,,,,,
داشتیم از خاطرتان می‌رفتیم (dấštim az xâtéretân mí-raftim),ما,داشتم از خاطرتان می‌رفتم (dấštam az xâtéretân mí-raftam),من,past progressive,داریم از خاطرتان می‌رویم (dấrim az xâtéretân mí-ravim),ما,دارم از خاطرتان می‌روم (dấram az xâtéretân mí-ravam),من,present progressive
داشتید از خاطرتان می‌رفتید (dấštid az xâtéretân mí-raftid),شما,داشتی از خاطرتان می‌رفتی (dấšti az xâtéretân mí-rafti),تو,دارید از خاطرتان می‌روید (dấrid az xâtéretân mí-ravid),شما,داری از خاطرتان می‌روی (dấri az xâtéretân mí-ravi),تو,,
داشتند از خاطرتان می‌رفتند (dấštand az xâtéretân mí-raftand),آنها,داشت از خاطرتان می‌رفت (dấšt az xâtéretân mí-raft),وی,دارند از خاطرتان می‌روند (dấrand az xâtéretân mí-ravand),آنها,دارد از خاطرتان می‌رود (dấrad az xâtéretân mí-ravad),وی,,
,,,,,,,,,
از خاطرتان رفته‌ایم (az xâtéretân rafté-im),ما,از خاطرتان رفته‌ام (az xâtéretân rafté-am),من,present perfect,از خاطرتان رفته بودیم (az xâtéretân rafté búdim),ما,از خاطرتان رفته بودم (az xâtéretân rafté búdam),من,pluperfect
از خاطرتان رفته‌اید (az xâtéretân rafté-id),شما,از خاطرتان رفته‌ای (az xâtéretân rafté-i),تو,از خاطرتان رفته بودید (az xâtéretân rafté búdid),شما,از خاطرتان رفته بودی (az xâtéretân rafté búdi),تو,,
از خاطرتان رفته‌اند (az xâtéretân rafté-and),آنها,از خاطرتان رفته است (az xâtéretân rafté ast),وی,از خاطرتان رفته بودند (az xâtéretân rafté búdand),آنها,از خاطرتان رفته بود (az xâtéretân rafté búd),وی,,
,,,,,,,,,
,از خاطرتان خواهیم رفت (az xâtéretân xâhím raft),ما,از خاطرتان خواهم رفت (az xâtéretân xâhám raft),من,future,,,,
از خاطرتان خواهید رفت (az xâtéretân xâhíd raft),شما,از خاطرتان خواهی رفت (az xâtéretân xâhí raft),تو,,,,,,
از خاطرتان خواهند رفت (az xâtéretân xâhánd raft),آنها,از خاطرتان خواهد رفت (az xâtéretân xâhád raft),وی,,,,,,
subjunctive,,,,,,,,,
از خاطرتان رفته باشیم (az xâtéretân rafté bấšim),ما,از خاطرتان رفته باشم (az xâtéretân rafté bấšam),من,past,از خاطرتان برویم (az xâtéretân béravim),ما,از خاطرتان بروم (az xâtéretân béravam),من,present
از خاطرتان رفته باشید (az xâtéretân rafté bấšid),شما,از خاطرتان رفته باشی (az xâtéretân rafté bấši),تو,از خاطرتان بروید (az xâtéretân béravid),شما,از خاطرتان بروی (az xâtéretân béravi),تو,,
از خاطرتان رفته باشند (az xâtéretân rafté bấšand),آنها,از خاطرتان رفته باشد (az xâtéretân rafté bấšad),وی,از خاطرتان بروند (az xâtéretân béravand),آنها,از خاطرتان برود (az xâtéretân béravad),وی,,
,,,,,,,,,
,از خاطرتان بروید (az xâtéretân béravid),شما,از خاطرتان برو (az xâtéretân bérav),تو,imperative,,,,
از خاطرتون رفتن (az xâtéretun raftán),infinitive,,,,,,,,
,,,,,,,,,
از خاطرتون رفت (az xâtéretun raft),past stem,از خاطرتون ره (az xâtéretun re),present stem,,,,,,
از خاطرتون رفته (az xâtéretun rafté),past participle,از خاطرتون رونده (az xâtéretun ravandé),present participle,,,,,,
indicative,,,,,,,,,
از خاطرتون رفتیم (az xâtéretun ráftim),ما,از خاطرتون رفتم (az xâtéretun ráftam),من,past,از خاطرتون ریم (az xâtéretun rim),ما,از خاطرتون رم (az xâtéretun ram),من,aorist
از خاطرتون رفتین (az xâtéretun ráftin),شما,از خاطرتون رفتی (az xâtéretun ráfti),تو,از خاطرتون رین (az xâtéretun rin),شما,از خاطرتون ری (az xâtéretun ri),تو,,
از خاطرتون رفتن (az xâtéretun ráftan),اونها,از خاطرتون رفت (az xâtéretun raft),اون,از خاطرتون رن (az xâtéretun ran),اونها,از خاطرتون ره (az xâtéretun re),اون,,
,,,,,,,,,
از خاطرتون می‌رفتیم (az xâtéretun mí-raftim),ما,از خاطرتون می‌رفتم (az xâtéretun mí-raftam),من,past (imperfect),از خاطرتون می‌ریم (az xâtéretun mí-rim),ما,از خاطرتون می‌رم (az xâtéretun mí-ram),من,present (imperfect)
از خاطرتون می‌رفتین (az xâtéretun mí-raftin),شما,از خاطرتون می‌رفتی (az xâtéretun mí-rafti),تو,از خاطرتون می‌رین (az xâtéretun mí-rin),شما,از خاطرتون می‌ری (az xâtéretun mí-ri),تو,,
از خاطرتون می‌رفتن (az xâtéretun mí-raftan),اونها,از خاطرتون می‌رفت (az xâtéretun mí-raft),اون,از خاطرتون می‌رن (az xâtéretun mí-ran),اونها,از خاطرتون می‌ره (az xâtéretun mí-re),اون,,
,,,,,,,,,
داشتیم از خاطرتون می‌رفتیم (dấštim az xâtéretun mí-raftim),ما,داشتم از خاطرتون می‌رفتم (dấštam az xâtéretun mí-raftam),من,past progressive,داریم از خاطرتون می‌ریم (dấrim az xâtéretun mí-rim),ما,دارم از خاطرتون می‌رم (dấram az xâtéretun mí-ram),من,present progressive
داشتین از خاطرتون می‌رفتین (dấštin az xâtéretun mí-raftin),شما,داشتی از خاطرتون می‌رفتی (dấšti az xâtéretun mí-rafti),تو,دارین از خاطرتون می‌رین (dấrin az xâtéretun mí-rin),شما,داری از خاطرتون می‌ری (dấri az xâtéretun mí-ri),تو,,
داشتن از خاطرتون می‌رفتن (dấštan az xâtéretun mí-raftan),اونها,داشت از خاطرتون می‌رفت (dấšt az xâtéretun mí-raft),اون,دارن از خاطرتون می‌رن (dấran az xâtéretun mí-ran),اونها,داره از خاطرتون می‌ره (dấre az xâtéretun mí-re),اون,,
,,,,,,,,,
از خاطرتون رفته‌ایم (az xâtéretun raftím),ما,از خاطرتون رفته‌ام (az xâtéretun raftám),من,present perfect,از خاطرتون رفته بودیم (az xâtéretun rafté búdim),ما,از خاطرتون رفته بودم (az xâtéretun rafté búdam),من,pluperfect
از خاطرتون رفته‌این (az xâtéretun raftín),شما,از خاطرتون رفته‌ای (az xâtéretun raftí),تو,از خاطرتون رفته بودین (az xâtéretun rafté búdin),شما,از خاطرتون رفته بودی (az xâtéretun rafté búdi),تو,,
از خاطرتون رفته‌ان (az xâtéretun raftán),اونها,از خاطرتون رفته (az xâtéretun rafté),اون,از خاطرتون رفته بودن (az xâtéretun rafté búdan),اونها,از خاطرتون رفته بود (az xâtéretun rafté bud),اون,,
subjunctive,,,,,,,,,
از خاطرتون رفته باشیم (az xâtéretun rafté bấšim),ما,از خاطرتون رفته باشم (az xâtéretun rafté bấšam),من,past,از خاطرتون بریم (az xâtéretun bérim),ما,از خاطرتون برم (az xâtéretun béram),من,present
از خاطرتون رفته باشین (az xâtéretun rafté bấšin),شما,از خاطرتون رفته باشی (az xâtéretun rafté bấši),تو,از خاطرتون برین (az xâtéretun bérin),شما,از خاطرتون بری (az xâtéretun béri),تو,,
از خاطرتون رفته باشن (az xâtéretun rafté bấšan),اونها,از خاطرتون رفته باشه (az xâtéretun rafté bấše),اون,از خاطرتون برن (az xâtéretun béran),اونها,از خاطرتون بره (az xâtéretun bére),اون,,
,,,,,,,,,
,از خاطرتون برین (az xâtéretun bérin),شما,از خاطرتون برو (az xâtéretun borô),تو,imperative,,,,
از خاطرتون رفتن (az xâtéretun raftán),infinitive,,,,,,,,
,,,,,,,,,
از خاطرتون رفت (az xâtéretun raft),past stem,از خاطرتون ره (az xâtéretun re),present stem,,,,,,
از خاطرتون رفته (az xâtéretun rafté),past participle,از خاطرتون رونده (az xâtéretun ravandé),present participle,,,,,,
indicative,,,,,,,,,
از خاطرتون رفتیم (az xâtéretun ráftim),ما,از خاطرتون رفتم (az xâtéretun ráftam),من,past,از خاطرتون ریم (az xâtéretun reym),ما,از خاطرتون رم (az xâtéretun ram),من,aorist
از خاطرتون رفتین (az xâtéretun ráftin),شما,از خاطرتون رفتی (az xâtéretun ráfti),تو,از خاطرتون رین (az xâtéretun reyn),شما,از خاطرتون ری (az xâtéretun rey),تو,,
از خاطرتون رفتن (az xâtéretun ráftan),اونها,از خاطرتون رفت (az xâtéretun raft),اون,از خاطرتون رن (az xâtéretun ran),اونها,"از خاطرتون ره / رد (az xâtéretun re, rad)",اون,,
,,,,,,,,,
از خاطرتون می‌رفتیم (az xâtéretun mí-raftim),ما,از خاطرتون می‌رفتم (az xâtéretun mí-raftam),من,past (imperfect),از خاطرتون می‌ریم (az xâtéretun mí-reym),ما,از خاطرتون می‌رم (az xâtéretun mí-ram),من,present (imperfect)
از خاطرتون می‌رفتین (az xâtéretun mí-raftin),شما,از خاطرتون می‌رفتی (az xâtéretun mí-rafti),تو,از خاطرتون می‌رین (az xâtéretun mí-reyn),شما,از خاطرتون می‌ری (az xâtéretun mí-rey),تو,,
از خاطرتون می‌رفتن (az xâtéretun mí-raftan),اونها,از خاطرتون می‌رفت (az xâtéretun mí-raft),اون,از خاطرتون می‌رن (az xâtéretun mí-ran),اونها,از خاطرتون می‌ره / می‌رد (az xâtéretun mí-re / mí-rad),اون,,
,,,,,,,,,
داشتیم از خاطرتون می‌رفتیم (dấštim az xâtéretun mí-raftim),ما,داشتم از خاطرتون می‌رفتم (dấštam az xâtéretun mí-raftam),من,past progressive,داریم از خاطرتون می‌ریم (dấrim az xâtéretun mí-reym),ما,دارم از خاطرتون می‌رم (dấram az xâtéretun mí-ram),من,present progressive
داشتین از خاطرتون می‌رفتین (dấštin az xâtéretun mí-raftin),شما,داشتی از خاطرتون می‌رفتی (dấšti az xâtéretun mí-rafti),تو,دارین از خاطرتون می‌رین (dấrin az xâtéretun mí-reyn),شما,داری از خاطرتون می‌ری (dấri az xâtéretun mí-rey),تو,,
داشتن از خاطرتون می‌رفتن (dấštan az xâtéretun mí-raftan),اونها,داشت از خاطرتون می‌رفت (dấšt az xâtéretun mí-raft),اون,دارن از خاطرتون می‌رن (dấran az xâtéretun mí-ran),اونها,داره از خاطرتون می‌ره / می‌رد (dấre az xâtéretun mí-re / mí-rad),اون,,
,,,,,,,,,
از خاطرتون رفته‌ایم (az xâtéretun raftím),ما,از خاطرتون رفته‌ام (az xâtéretun raftám),من,present perfect,از خاطرتون رفته بودیم (az xâtéretun rafté búdim),ما,از خاطرتون رفته بودم (az xâtéretun rafté búdam),من,pluperfect
از خاطرتون رفته‌این (az xâtéretun raftín),شما,از خاطرتون رفته‌ای (az xâtéretun raftí),تو,از خاطرتون رفته بودین (az xâtéretun rafté búdin),شما,از خاطرتون رفته بودی (az xâtéretun rafté búdi),تو,,
از خاطرتون رفته‌ان (az xâtéretun raftán),اونها,از خاطرتون رفته (az xâtéretun rafté),اون,از خاطرتون رفته بودن (az xâtéretun rafté búdan),اونها,از خاطرتون رفته بود (az xâtéretun rafté bud),اون,,
subjunctive,,,,,,,,,
از خاطرتون رفته باشیم (az xâtéretun rafté bấšim),ما,از خاطرتون رفته باشم (az xâtéretun rafté bấšam),من,past,از خاطرتون بریم (az xâtéretun béreym),ما,از خاطرتون برم (az xâtéretun béram),من,present
از خاطرتون رفته باشین (az xâtéretun rafté bấšin),شما,از خاطرتون رفته باشی (az xâtéretun rafté bấši),تو,از خاطرتون برین (az xâtéretun béreyn),شما,از خاطرتون بری (az xâtéretun bérey),تو,,
از خاطرتون رفته باشن (az xâtéretun rafté bấšan),اونها,از خاطرتون رفته باشه (az xâtéretun rafté bấše),اون,از خاطرتون برن (az xâtéretun béran),اونها,"از خاطرتون بره / برد (az xâtéretun bére, bérad)",اون,,
,,,,,,,,,
,از خاطرتون برین (az xâtéretun béreyn),شما,از خاطرتون برو (az xâtéretun borô),تو,imperative,,,,
از خاطرشان رفتن (az xâtérešân raftán),infinitive,,,,,,,,
,,,,,,,,,
از خاطرشان رفت (az xâtérešân raft),past stem,از خاطرشان رو (az xâtérešân rav),present stem,,,,,,
از خاطرشان رفته (az xâtérešân rafté),past participle,از خاطرشان رونده (az xâtérešân ravandé),present participle,,,,,,
indicative,,,,,,,,,
از خاطرشان رفتیم (az xâtérešân ráftim),ما,از خاطرشان رفتم (az xâtérešân ráftam),من,past,از خاطرشان رویم (az xâtérešân rávim),ما,از خاطرشان روم (az xâtérešân rávam),من,aorist
از خاطرشان رفتید (az xâtérešân ráftid),شما,از خاطرشان رفتی (az xâtérešân ráfti),تو,از خاطرشان روید (az xâtérešân rávid),شما,از خاطرشان روی (az xâtérešân rávi),تو,,
از خاطرشان رفتند (az xâtérešân ráftand),آنها,از خاطرشان رفت (az xâtérešân raft),وی,از خاطرشان روند (az xâtérešân rávand),آنها,از خاطرشان رود (az xâtérešân rávad),وی,,
,,,,,,,,,
از خاطرشان می‌رفتیم (az xâtérešân mí-raftim),ما,از خاطرشان می‌رفتم (az xâtérešân mí-raftam),من,past (imperfect),از خاطرشان می‌رویم (az xâtérešân mí-ravim),ما,از خاطرشان می‌روم (az xâtérešân mí-ravam),من,present (imperfect)
از خاطرشان می‌رفتید (az xâtérešân mí-raftid),شما,از خاطرشان می‌رفتی (az xâtérešân mí-rafti),تو,از خاطرشان می‌روید (az xâtérešân mí-ravid),شما,از خاطرشان می‌روی (az xâtérešân mí-ravi),تو,,
از خاطرشان می‌رفتند (az xâtérešân mí-raftand),آنها,از خاطرشان می‌رفت (az xâtérešân mí-raft),وی,از خاطرشان می‌روند (az xâtérešân mí-ravand),آنها,از خاطرشان می‌رود (az xâtérešân mí-ravad),وی,,
,,,,,,,,,
داشتیم از خاطرشان می‌رفتیم (dấštim az xâtérešân mí-raftim),ما,داشتم از خاطرشان می‌رفتم (dấštam az xâtérešân mí-raftam),من,past progressive,داریم از خاطرشان می‌رویم (dấrim az xâtérešân mí-ravim),ما,دارم از خاطرشان می‌روم (dấram az xâtérešân mí-ravam),من,present progressive
داشتید از خاطرشان می‌رفتید (dấštid az xâtérešân mí-raftid),شما,داشتی از خاطرشان می‌رفتی (dấšti az xâtérešân mí-rafti),تو,دارید از خاطرشان می‌روید (dấrid az xâtérešân mí-ravid),شما,داری از خاطرشان می‌روی (dấri az xâtérešân mí-ravi),تو,,
داشتند از خاطرشان می‌رفتند (dấštand az xâtérešân mí-raftand),آنها,داشت از خاطرشان می‌رفت (dấšt az xâtérešân mí-raft),وی,دارند از خاطرشان می‌روند (dấrand az xâtérešân mí-ravand),آنها,دارد از خاطرشان می‌رود (dấrad az xâtérešân mí-ravad),وی,,
,,,,,,,,,
از خاطرشان رفته‌ایم (az xâtérešân rafté-im),ما,از خاطرشان رفته‌ام (az xâtérešân rafté-am),من,present perfect,از خاطرشان رفته بودیم (az xâtérešân rafté búdim),ما,از خاطرشان رفته بودم (az xâtérešân rafté búdam),من,pluperfect
از خاطرشان رفته‌اید (az xâtérešân rafté-id),شما,از خاطرشان رفته‌ای (az xâtérešân rafté-i),تو,از خاطرشان رفته بودید (az xâtérešân rafté búdid),شما,از خاطرشان رفته بودی (az xâtérešân rafté búdi),تو,,
