0,1,2,3,4,5,6,7,8,9
داشتین از خاطرت می‌رفتین (dấštin az xâtéret mí-raftin),شما,داشتی از خاطرت می‌رفتی (dấšti az xâtéret mí-rafti),تو,دارین از خاطرت می‌رین (dấrin az xâtéret mí-reyn),شما,داری از خاطرت می‌ری (dấri az xâtéret mí-rey),تو,,
داشتن از خاطرت می‌رفتن (dấštan az xâtéret mí-raftan),اونها,داشت از خاطرت می‌رفت (dấšt az xâtéret mí-raft),اون,دارن از خاطرت می‌رن (dấran az xâtéret mí-ran),اونها,داره از خاطرت می‌ره / می‌رد (dấre az xâtéret mí-re / mí-rad),اون,,
,,,,,,,,,
از خاطرت رفته‌ایم (az xâtéret raftím),ما,از خاطرت رفته‌ام (az xâtéret raftám),من,present perfect,از خاطرت رفته بودیم (az xâtéret rafté búdim),ما,از خاطرت رفته بودم (az xâtéret rafté búdam),من,pluperfect
از خاطرت رفته‌این (az xâtéret raftín),شما,از خاطرت رفته‌ای (az xâtéret raftí),تو,از خاطرت رفته بودین (az xâtéret rafté búdin),شما,از خاطرت رفته بودی (az xâtéret rafté búdi),تو,,
از خاطرت رفته‌ان (az xâtéret raftán),اونها,از خاطرت رفته (az xâtéret rafté),اون,از خاطرت رفته بودن (az xâtéret rafté búdan),اونها,از خاطرت رفته بود (az xâtéret rafté bud),اون,,
subjunctive,,,,,,,,,
از خاطرت رفته باشیم (az xâtéret rafté bấšim),ما,از خاطرت رفته باشم (az xâtéret rafté bấšam),من,past,از خاطرت بریم (az xâtéret béreym),ما,از خاطرت برم (az xâtéret béram),من,present
از خاطرت رفته باشین (az xâtéret rafté bấšin),شما,از خاطرت رفته باشی (az xâtéret rafté bấši),تو,از خاطرت برین (az xâtéret béreyn),شما,از خاطرت بری (az xâtéret bérey),تو,,
از خاطرت رفته باشن (az xâtéret rafté bấšan),اونها,از خاطرت رفته باشه (az xâtéret rafté bấše),اون,از خاطرت برن (az xâtéret béran),اونها,"از خاطرت بره / برد (az xâtéret bére, bérad)",اون,,
,,,,,,,,,
,از خاطرت برین (az xâtéret béreyn),شما,از خاطرت برو (az xâtéret borô),تو,imperative,,,,
از خاطرش رفتن (az xâtéraš raftán),infinitive,,,,,,,,
,,,,,,,,,
از خاطرش رفت (az xâtéraš raft),past stem,از خاطرش رو (az xâtéraš rav),present stem,,,,,,
از خاطرش رفته (az xâtéraš rafté),past participle,از خاطرش رونده (az xâtéraš ravandé),present participle,,,,,,
indicative,,,,,,,,,
از خاطرش رفتیم (az xâtéraš ráftim),ما,از خاطرش رفتم (az xâtéraš ráftam),من,past,از خاطرش رویم (az xâtéraš rávim),ما,از خاطرش روم (az xâtéraš rávam),من,aorist
از خاطرش رفتید (az xâtéraš ráftid),شما,از خاطرش رفتی (az xâtéraš ráfti),تو,از خاطرش روید (az xâtéraš rávid),شما,از خاطرش روی (az xâtéraš rávi),تو,,
از خاطرش رفتند (az xâtéraš ráftand),آنها,از خاطرش رفت (az xâtéraš raft),وی,از خاطرش روند (az xâtéraš rávand),آنها,از خاطرش رود (az xâtéraš rávad),وی,,
,,,,,,,,,
از خاطرش می‌رفتیم (az xâtéraš mí-raftim),ما,از خاطرش می‌رفتم (az xâtéraš mí-raftam),من,past (imperfect),از خاطرش می‌رویم (az xâtéraš mí-ravim),ما,از خاطرش می‌روم (az xâtéraš mí-ravam),من,present (imperfect)
از خاطرش می‌رفتید (az xâtéraš mí-raftid),شما,از خاطرش می‌رفتی (az xâtéraš mí-rafti),تو,از خاطرش می‌روید (az xâtéraš mí-ravid),شما,از خاطرش می‌روی (az xâtéraš mí-ravi),تو,,
از خاطرش می‌رفتند (az xâtéraš mí-raftand),آنها,از خاطرش می‌رفت (az xâtéraš mí-raft),وی,از خاطرش می‌روند (az xâtéraš mí-ravand),آنها,از خاطرش می‌رود (az xâtéraš mí-ravad),وی,,
,,,,,,,,,
داشتیم از خاطرش می‌رفتیم (dấštim az xâtéraš mí-raftim),ما,داشتم از خاطرش می‌رفتم (dấštam az xâtéraš mí-raftam),من,past progressive,داریم از خاطرش می‌رویم (dấrim az xâtéraš mí-ravim),ما,دارم از خاطرش می‌روم (dấram az xâtéraš mí-ravam),من,present progressive
داشتید از خاطرش می‌رفتید (dấštid az xâtéraš mí-raftid),شما,داشتی از خاطرش می‌رفتی (dấšti az xâtéraš mí-rafti),تو,دارید از خاطرش می‌روید (dấrid az xâtéraš mí-ravid),شما,داری از خاطرش می‌روی (dấri az xâtéraš mí-ravi),تو,,
داشتند از خاطرش می‌رفتند (dấštand az xâtéraš mí-raftand),آنها,داشت از خاطرش می‌رفت (dấšt az xâtéraš mí-raft),وی,دارند از خاطرش می‌روند (dấrand az xâtéraš mí-ravand),آنها,دارد از خاطرش می‌رود (dấrad az xâtéraš mí-ravad),وی,,
,,,,,,,,,
از خاطرش رفته‌ایم (az xâtéraš rafté-im),ما,از خاطرش رفته‌ام (az xâtéraš rafté-am),من,present perfect,از خاطرش رفته بودیم (az xâtéraš rafté búdim),ما,از خاطرش رفته بودم (az xâtéraš rafté búdam),من,pluperfect
از خاطرش رفته‌اید (az xâtéraš rafté-id),شما,از خاطرش رفته‌ای (az xâtéraš rafté-i),تو,از خاطرش رفته بودید (az xâtéraš rafté búdid),شما,از خاطرش رفته بودی (az xâtéraš rafté búdi),تو,,
از خاطرش رفته‌اند (az xâtéraš rafté-and),آنها,از خاطرش رفته است (az xâtéraš rafté ast),وی,از خاطرش رفته بودند (az xâtéraš rafté búdand),آنها,از خاطرش رفته بود (az xâtéraš rafté búd),وی,,
,,,,,,,,,
,از خاطرش خواهیم رفت (az xâtéraš xâhím raft),ما,از خاطرش خواهم رفت (az xâtéraš xâhám raft),من,future,,,,
از خاطرش خواهید رفت (az xâtéraš xâhíd raft),شما,از خاطرش خواهی رفت (az xâtéraš xâhí raft),تو,,,,,,
از خاطرش خواهند رفت (az xâtéraš xâhánd raft),آنها,از خاطرش خواهد رفت (az xâtéraš xâhád raft),وی,,,,,,
subjunctive,,,,,,,,,
از خاطرش رفته باشیم (az xâtéraš rafté bấšim),ما,از خاطرش رفته باشم (az xâtéraš rafté bấšam),من,past,از خاطرش برویم (az xâtéraš béravim),ما,از خاطرش بروم (az xâtéraš béravam),من,present
از خاطرش رفته باشید (az xâtéraš rafté bấšid),شما,از خاطرش رفته باشی (az xâtéraš rafté bấši),تو,از خاطرش بروید (az xâtéraš béravid),شما,از خاطرش بروی (az xâtéraš béravi),تو,,
از خاطرش رفته باشند (az xâtéraš rafté bấšand),آنها,از خاطرش رفته باشد (az xâtéraš rafté bấšad),وی,از خاطرش بروند (az xâtéraš béravand),آنها,از خاطرش برود (az xâtéraš béravad),وی,,
,,,,,,,,,
,از خاطرش بروید (az xâtéraš béravid),شما,از خاطرش برو (az xâtéraš bérav),تو,imperative,,,,
از خاطرش رفتن (az xâtéreš raftán),infinitive,,,,,,,,
,,,,,,,,,
از خاطرش رفت (az xâtéreš raft),past stem,از خاطرش ره (az xâtéreš re),present stem,,,,,,
از خاطرش رفته (az xâtéreš rafté),past participle,از خاطرش رونده (az xâtéreš ravandé),present participle,,,,,,
indicative,,,,,,,,,
از خاطرش رفتیم (az xâtéreš ráftim),ما,از خاطرش رفتم (az xâtéreš ráftam),من,past,از خاطرش ریم (az xâtéreš rim),ما,از خاطرش رم (az xâtéreš ram),من,aorist
از خاطرش رفتین (az xâtéreš ráftin),شما,از خاطرش رفتی (az xâtéreš ráfti),تو,از خاطرش رین (az xâtéreš rin),شما,از خاطرش ری (az xâtéreš ri),تو,,
از خاطرش رفتن (az xâtéreš ráftan),اونها,از خاطرش رفت (az xâtéreš raft),اون,از خاطرش رن (az xâtéreš ran),اونها,از خاطرش ره (az xâtéreš re),اون,,
,,,,,,,,,
از خاطرش می‌رفتیم (az xâtéreš mí-raftim),ما,از خاطرش می‌رفتم (az xâtéreš mí-raftam),من,past (imperfect),از خاطرش می‌ریم (az xâtéreš mí-rim),ما,از خاطرش می‌رم (az xâtéreš mí-ram),من,present (imperfect)
از خاطرش می‌رفتین (az xâtéreš mí-raftin),شما,از خاطرش می‌رفتی (az xâtéreš mí-rafti),تو,از خاطرش می‌رین (az xâtéreš mí-rin),شما,از خاطرش می‌ری (az xâtéreš mí-ri),تو,,
از خاطرش می‌رفتن (az xâtéreš mí-raftan),اونها,از خاطرش می‌رفت (az xâtéreš mí-raft),اون,از خاطرش می‌رن (az xâtéreš mí-ran),اونها,از خاطرش می‌ره (az xâtéreš mí-re),اون,,
,,,,,,,,,
داشتیم از خاطرش می‌رفتیم (dấštim az xâtéreš mí-raftim),ما,داشتم از خاطرش می‌رفتم (dấštam az xâtéreš mí-raftam),من,past progressive,داریم از خاطرش می‌ریم (dấrim az xâtéreš mí-rim),ما,دارم از خاطرش می‌رم (dấram az xâtéreš mí-ram),من,present progressive
داشتین از خاطرش می‌رفتین (dấštin az xâtéreš mí-raftin),شما,داشتی از خاطرش می‌رفتی (dấšti az xâtéreš mí-rafti),تو,دارین از خاطرش می‌رین (dấrin az xâtéreš mí-rin),شما,داری از خاطرش می‌ری (dấri az xâtéreš mí-ri),تو,,
داشتن از خاطرش می‌رفتن (dấštan az xâtéreš mí-raftan),اونها,داشت از خاطرش می‌رفت (dấšt az xâtéreš mí-raft),اون,دارن از خاطرش می‌رن (dấran az xâtéreš mí-ran),اونها,داره از خاطرش می‌ره (dấre az xâtéreš mí-re),اون,,
,,,,,,,,,
از خاطرش رفته‌ایم (az xâtéreš raftím),ما,از خاطرش رفته‌ام (az xâtéreš raftám),من,present perfect,از خاطرش رفته بودیم (az xâtéreš rafté búdim),ما,از خاطرش رفته بودم (az xâtéreš rafté búdam),من,pluperfect
از خاطرش رفته‌این (az xâtéreš raftín),شما,از خاطرش رفته‌ای (az xâtéreš raftí),تو,از خاطرش رفته بودین (az xâtéreš rafté búdin),شما,از خاطرش رفته بودی (az xâtéreš rafté búdi),تو,,
از خاطرش رفته‌ان (az xâtéreš raftán),اونها,از خاطرش رفته (az xâtéreš rafté),اون,از خاطرش رفته بودن (az xâtéreš rafté búdan),اونها,از خاطرش رفته بود (az xâtéreš rafté bud),اون,,
subjunctive,,,,,,,,,
از خاطرش رفته باشیم (az xâtéreš rafté bấšim),ما,از خاطرش رفته باشم (az xâtéreš rafté bấšam),من,past,از خاطرش بریم (az xâtéreš bérim),ما,از خاطرش برم (az xâtéreš béram),من,present
از خاطرش رفته باشین (az xâtéreš rafté bấšin),شما,از خاطرش رفته باشی (az xâtéreš rafté bấši),تو,از خاطرش برین (az xâtéreš bérin),شما,از خاطرش بری (az xâtéreš béri),تو,,
از خاطرش رفته باشن (az xâtéreš rafté bấšan),اونها,از خاطرش رفته باشه (az xâtéreš rafté bấše),اون,از خاطرش برن (az xâtéreš béran),اونها,از خاطرش بره (az xâtéreš bére),اون,,
,,,,,,,,,
,از خاطرش برین (az xâtéreš bérin),شما,از خاطرش برو (az xâtéreš borô),تو,imperative,,,,
از خاطرش رفتن (az xâtéreš raftán),infinitive,,,,,,,,
,,,,,,,,,
از خاطرش رفت (az xâtéreš raft),past stem,از خاطرش ره (az xâtéreš re),present stem,,,,,,
از خاطرش رفته (az xâtéreš rafté),past participle,از خاطرش رونده (az xâtéreš ravandé),present participle,,,,,,
indicative,,,,,,,,,
از خاطرش رفتیم (az xâtéreš ráftim),ما,از خاطرش رفتم (az xâtéreš ráftam),من,past,از خاطرش ریم (az xâtéreš reym),ما,از خاطرش رم (az xâtéreš ram),من,aorist
از خاطرش رفتین (az xâtéreš ráftin),شما,از خاطرش رفتی (az xâtéreš ráfti),تو,از خاطرش رین (az xâtéreš reyn),شما,از خاطرش ری (az xâtéreš rey),تو,,
از خاطرش رفتن (az xâtéreš ráftan),اونها,از خاطرش رفت (az xâtéreš raft),اون,از خاطرش رن (az xâtéreš ran),اونها,"از خاطرش ره / رد (az xâtéreš re, rad)",اون,,
,,,,,,,,,
از خاطرش می‌رفتیم (az xâtéreš mí-raftim),ما,از خاطرش می‌رفتم (az xâtéreš mí-raftam),من,past (imperfect),از خاطرش می‌ریم (az xâtéreš mí-reym),ما,از خاطرش می‌رم (az xâtéreš mí-ram),من,present (imperfect)
از خاطرش می‌رفتین (az xâtéreš mí-raftin),شما,از خاطرش می‌رفتی (az xâtéreš mí-rafti),تو,از خاطرش می‌رین (az xâtéreš mí-reyn),شما,از خاطرش می‌ری (az xâtéreš mí-rey),تو,,
از خاطرش می‌رفتن (az xâtéreš mí-raftan),اونها,از خاطرش می‌رفت (az xâtéreš mí-raft),اون,از خاطرش می‌رن (az xâtéreš mí-ran),اونها,از خاطرش می‌ره / می‌رد (az xâtéreš mí-re / mí-rad),اون,,
,,,,,,,,,
داشتیم از خاطرش می‌رفتیم (dấštim az xâtéreš mí-raftim),ما,داشتم از خاطرش می‌رفتم (dấštam az xâtéreš mí-raftam),من,past progressive,داریم از خاطرش می‌ریم (dấrim az xâtéreš mí-reym),ما,دارم از خاطرش می‌رم (dấram az xâtéreš mí-ram),من,present progressive
داشتین از خاطرش می‌رفتین (dấštin az xâtéreš mí-raftin),شما,داشتی از خاطرش می‌رفتی (dấšti az xâtéreš mí-rafti),تو,دارین از خاطرش می‌رین (dấrin az xâtéreš mí-reyn),شما,داری از خاطرش می‌ری (dấri az xâtéreš mí-rey),تو,,
داشتن از خاطرش می‌رفتن (dấštan az xâtéreš mí-raftan),اونها,داشت از خاطرش می‌رفت (dấšt az xâtéreš mí-raft),اون,دارن از خاطرش می‌رن (dấran az xâtéreš mí-ran),اونها,داره از خاطرش می‌ره / می‌رد (dấre az xâtéreš mí-re / mí-rad),اون,,
,,,,,,,,,
از خاطرش رفته‌ایم (az xâtéreš raftím),ما,از خاطرش رفته‌ام (az xâtéreš raftám),من,present perfect,از خاطرش رفته بودیم (az xâtéreš rafté búdim),ما,از خاطرش رفته بودم (az xâtéreš rafté búdam),من,pluperfect
از خاطرش رفته‌این (az xâtéreš raftín),شما,از خاطرش رفته‌ای (az xâtéreš raftí),تو,از خاطرش رفته بودین (az xâtéreš rafté búdin),شما,از خاطرش رفته بودی (az xâtéreš rafté búdi),تو,,
از خاطرش رفته‌ان (az xâtéreš raftán),اونها,از خاطرش رفته (az xâtéreš rafté),اون,از خاطرش رفته بودن (az xâtéreš rafté búdan),اونها,از خاطرش رفته بود (az xâtéreš rafté bud),اون,,
subjunctive,,,,,,,,,
از خاطرش رفته باشیم (az xâtéreš rafté bấšim),ما,از خاطرش رفته باشم (az xâtéreš rafté bấšam),من,past,از خاطرش بریم (az xâtéreš béreym),ما,از خاطرش برم (az xâtéreš béram),من,present
از خاطرش رفته باشین (az xâtéreš rafté bấšin),شما,از خاطرش رفته باشی (az xâtéreš rafté bấši),تو,از خاطرش برین (az xâtéreš béreyn),شما,از خاطرش بری (az xâtéreš bérey),تو,,
از خاطرش رفته باشن (az xâtéreš rafté bấšan),اونها,از خاطرش رفته باشه (az xâtéreš rafté bấše),اون,از خاطرش برن (az xâtéreš béran),اونها,"از خاطرش بره / برد (az xâtéreš bére, bérad)",اون,,
,,,,,,,,,
,از خاطرش برین (az xâtéreš béreyn),شما,از خاطرش برو (az xâtéreš borô),تو,imperative,,,,
از خاطرمان رفتن (az xâtéremân raftán),infinitive,,,,,,,,
,,,,,,,,,
از خاطرمان رفت (az xâtéremân raft),past stem,از خاطرمان رو (az xâtéremân rav),present stem,,,,,,
از خاطرمان رفته (az xâtéremân rafté),past participle,از خاطرمان رونده (az xâtéremân ravandé),present participle,,,,,,
indicative,,,,,,,,,
از خاطرمان رفتیم (az xâtéremân ráftim),ما,از خاطرمان رفتم (az xâtéremân ráftam),من,past,از خاطرمان رویم (az xâtéremân rávim),ما,از خاطرمان روم (az xâtéremân rávam),من,aorist
از خاطرمان رفتید (az xâtéremân ráftid),شما,از خاطرمان رفتی (az xâtéremân ráfti),تو,از خاطرمان روید (az xâtéremân rávid),شما,از خاطرمان روی (az xâtéremân rávi),تو,,
از خاطرمان رفتند (az xâtéremân ráftand),آنها,از خاطرمان رفت (az xâtéremân raft),وی,از خاطرمان روند (az xâtéremân rávand),آنها,از خاطرمان رود (az xâtéremân rávad),وی,,
,,,,,,,,,
از خاطرمان می‌رفتیم (az xâtéremân mí-raftim),ما,از خاطرمان می‌رفتم (az xâtéremân mí-raftam),من,past (imperfect),از خاطرمان می‌رویم (az xâtéremân mí-ravim),ما,از خاطرمان می‌روم (az xâtéremân mí-ravam),من,present (imperfect)
از خاطرمان می‌رفتید (az xâtéremân mí-raftid),شما,از خاطرمان می‌رفتی (az xâtéremân mí-rafti),تو,از خاطرمان می‌روید (az xâtéremân mí-ravid),شما,از خاطرمان می‌روی (az xâtéremân mí-ravi),تو,,
از خاطرمان می‌رفتند (az xâtéremân mí-raftand),آنها,از خاطرمان می‌رفت (az xâtéremân mí-raft),وی,از خاطرمان می‌روند (az xâtéremân mí-ravand),آنها,از خاطرمان می‌رود (az xâtéremân mí-ravad),وی,,
,,,,,,,,,
داشتیم از خاطرمان می‌رفتیم (dấštim az xâtéremân mí-raftim),ما,داشتم از خاطرمان می‌رفتم (dấštam az xâtéremân mí-raftam),من,past progressive,داریم از خاطرمان می‌رویم (dấrim az xâtéremân mí-ravim),ما,دارم از خاطرمان می‌روم (dấram az xâtéremân mí-ravam),من,present progressive
داشتید از خاطرمان می‌رفتید (dấštid az xâtéremân mí-raftid),شما,داشتی از خاطرمان می‌رفتی (dấšti az xâtéremân mí-rafti),تو,دارید از خاطرمان می‌روید (dấrid az xâtéremân mí-ravid),شما,داری از خاطرمان می‌روی (dấri az xâtéremân mí-ravi),تو,,
داشتند از خاطرمان می‌رفتند (dấštand az xâtéremân mí-raftand),آنها,داشت از خاطرمان می‌رفت (dấšt az xâtéremân mí-raft),وی,دارند از خاطرمان می‌روند (dấrand az xâtéremân mí-ravand),آنها,دارد از خاطرمان می‌رود (dấrad az xâtéremân mí-ravad),وی,,
,,,,,,,,,
از خاطرمان رفته‌ایم (az xâtéremân rafté-im),ما,از خاطرمان رفته‌ام (az xâtéremân rafté-am),من,present perfect,از خاطرمان رفته بودیم (az xâtéremân rafté búdim),ما,از خاطرمان رفته بودم (az xâtéremân rafté búdam),من,pluperfect
از خاطرمان رفته‌اید (az xâtéremân rafté-id),شما,از خاطرمان رفته‌ای (az xâtéremân rafté-i),تو,از خاطرمان رفته بودید (az xâtéremân rafté búdid),شما,از خاطرمان رفته بودی (az xâtéremân rafté búdi),تو,,
از خاطرمان رفته‌اند (az xâtéremân rafté-and),آنها,از خاطرمان رفته است (az xâtéremân rafté ast),وی,از خاطرمان رفته بودند (az xâtéremân rafté búdand),آنها,از خاطرمان رفته بود (az xâtéremân rafté búd),وی,,
,,,,,,,,,
,از خاطرمان خواهیم رفت (az xâtéremân xâhím raft),ما,از خاطرمان خواهم رفت (az xâtéremân xâhám raft),من,future,,,,
از خاطرمان خواهید رفت (az xâtéremân xâhíd raft),شما,از خاطرمان خواهی رفت (az xâtéremân xâhí raft),تو,,,,,,
از خاطرمان خواهند رفت (az xâtéremân xâhánd raft),آنها,از خاطرمان خواهد رفت (az xâtéremân xâhád raft),وی,,,,,,
subjunctive,,,,,,,,,
از خاطرمان رفته باشیم (az xâtéremân rafté bấšim),ما,از خاطرمان رفته باشم (az xâtéremân rafté bấšam),من,past,از خاطرمان برویم (az xâtéremân béravim),ما,از خاطرمان بروم (az xâtéremân béravam),من,present
از خاطرمان رفته باشید (az xâtéremân rafté bấšid),شما,از خاطرمان رفته باشی (az xâtéremân rafté bấši),تو,از خاطرمان بروید (az xâtéremân béravid),شما,از خاطرمان بروی (az xâtéremân béravi),تو,,
از خاطرمان رفته باشند (az xâtéremân rafté bấšand),آنها,از خاطرمان رفته باشد (az xâtéremân rafté bấšad),وی,از خاطرمان بروند (az xâtéremân béravand),آنها,از خاطرمان برود (az xâtéremân béravad),وی,,
,,,,,,,,,
,از خاطرمان بروید (az xâtéremân béravid),شما,از خاطرمان برو (az xâtéremân bérav),تو,imperative,,,,
از خاطرمون رفتن (az xâtéremun raftán),infinitive,,,,,,,,
,,,,,,,,,
از خاطرمون رفت (az xâtéremun raft),past stem,از خاطرمون ره (az xâtéremun re),present stem,,,,,,
از خاطرمون رفته (az xâtéremun rafté),past participle,از خاطرمون رونده (az xâtéremun ravandé),present participle,,,,,,
indicative,,,,,,,,,
از خاطرمون رفتیم (az xâtéremun ráftim),ما,از خاطرمون رفتم (az xâtéremun ráftam),من,past,از خاطرمون ریم (az xâtéremun rim),ما,از خاطرمون رم (az xâtéremun ram),من,aorist
از خاطرمون رفتین (az xâtéremun ráftin),شما,از خاطرمون رفتی (az xâtéremun ráfti),تو,از خاطرمون رین (az xâtéremun rin),شما,از خاطرمون ری (az xâtéremun ri),تو,,
از خاطرمون رفتن (az xâtéremun ráftan),اونها,از خاطرمون رفت (az xâtéremun raft),اون,از خاطرمون رن (az xâtéremun ran),اونها,از خاطرمون ره (az xâtéremun re),اون,,
,,,,,,,,,
از خاطرمون می‌رفتیم (az xâtéremun mí-raftim),ما,از خاطرمون می‌رفتم (az xâtéremun mí-raftam),من,past (imperfect),از خاطرمون می‌ریم (az xâtéremun mí-rim),ما,از خاطرمون می‌رم (az xâtéremun mí-ram),من,present (imperfect)
از خاطرمون می‌رفتین (az xâtéremun mí-raftin),شما,از خاطرمون می‌رفتی (az xâtéremun mí-rafti),تو,از خاطرمون می‌رین (az xâtéremun mí-rin),شما,از خاطرمون می‌ری (az xâtéremun mí-ri),تو,,
از خاطرمون می‌رفتن (az xâtéremun mí-raftan),اونها,از خاطرمون می‌رفت (az xâtéremun mí-raft),اون,از خاطرمون می‌رن (az xâtéremun mí-ran),اونها,از خاطرمون می‌ره (az xâtéremun mí-re),اون,,
,,,,,,,,,
داشتیم از خاطرمون می‌رفتیم (dấštim az xâtéremun mí-raftim),ما,داشتم از خاطرمون می‌رفتم (dấštam az xâtéremun mí-raftam),من,past progressive,داریم از خاطرمون می‌ریم (dấrim az xâtéremun mí-rim),ما,دارم از خاطرمون می‌رم (dấram az xâtéremun mí-ram),من,present progressive
داشتین از خاطرمون می‌رفتین (dấštin az xâtéremun mí-raftin),شما,داشتی از خاطرمون می‌رفتی (dấšti az xâtéremun mí-rafti),تو,دارین از خاطرمون می‌رین (dấrin az xâtéremun mí-rin),شما,داری از خاطرمون می‌ری (dấri az xâtéremun mí-ri),تو,,
داشتن از خاطرمون می‌رفتن (dấštan az xâtéremun mí-raftan),اونها,داشت از خاطرمون می‌رفت (dấšt az xâtéremun mí-raft),اون,دارن از خاطرمون می‌رن (dấran az xâtéremun mí-ran),اونها,داره از خاطرمون می‌ره (dấre az xâtéremun mí-re),اون,,
,,,,,,,,,
از خاطرمون رفته‌ایم (az xâtéremun raftím),ما,از خاطرمون رفته‌ام (az xâtéremun raftám),من,present perfect,از خاطرمون رفته بودیم (az xâtéremun rafté búdim),ما,از خاطرمون رفته بودم (az xâtéremun rafté búdam),من,pluperfect
